Date,Reference,Taxonomic Group,Data type,Full organism,Morphospace,Disparity,Test,Phylo corrected,Alternative,
2017,Not available (citation),-,-,-,-,-,-,-,Not available (citation),
2017,"Randau, Marcela, and Anjali Goswami. ""Unravelling intravertebral integration, modularity and disparity in Felidae (Mammalia)."" Evolution & Development 19.2 (2017): 85-95.",Felids,3D landmarks,No,Procrustes PCA,Procrustes variance + Procrustes distance,NA,No,,
2017,"Allaire, Ninon, et al. ""Morphological disparity and systematic revision of the eocrinoid genus Rhopalocystis (Echinodermata, Blastozoa) from the Lower Ordovician of the central Anti-Atlas (Morocco)."" Journal of Paleontology 91.4 (2017): 685-714.",Echinoderms,1D Continuous,Yes,PCA,PCA variance,"MANOVA , LDA",No,,
2017,"Zhou, Chang-Fu, et al. ""Earliest filter-feeding pterosaur from the Jurassic of China and ecological evolution of Pterodactyloidea."" Royal Society Open Science 4.2 (2017): 160672.",Pterosaurs,Discrete,Yes,MDS,Gower distance,PERMANOVA,No,,
2017,"Lamsdell, James C., et al. ""Phylogenetic Paleoecology: Tree-Thinking and Ecology in Deep Time."" Trends in Ecology & Evolution (2017).",-,-,-,-,-,-,-,review,
2017,"Hopkins, Melanie J. ""How well does a part represent the whole? A comparison of cranidial shape evolution with exoskeletal character evolution in the trilobite family Pterocephaliidae."" Palaeontology 60.3 (2017): 309-318.",Trilobites,2D landmarks,Yes,Procrustes PCA,sum of ranges + sum of variance,Model fitting,No (but mapped),,
2017,"Sieriebriennikov, Bogdan, et al. ""The Role of DAF-21/Hsp90 in Mouth-Form Plasticity in Pristionchus pacificus."" Molecular Biology and Evolution 34.7 (2017): 1644-1653.",Nematode,2D landmarks,Yes,Procrustes PCA,sum of variance,t-test,No,,
2017,"Koenders, Annette, et al. ""Valve shape is not linked to genetic species in the Eucypris virens (Ostracoda, Crustacea) species complex."" Zoological Journal of the Linnean Society 180.1 (2017): 36-46.",Ostracodes,B-spline,Yes,FMD (Foote 1993),Euclidean distance,PERMANOVA,No,,
2017,"Mongiardino Koch, N., et al. ""Discrete and morphometric traits reveal contrasting patterns and processes in the macroevolutionary history of a clade of scorpions."" Journal of Evolutionary Biology 30.4 (2017): 814-825.",Scorpions,Discrete,Yes,PCO,sum of ranges + sum of variance + mean square euclidean distance,ANOVA,Yes,,
2017,"Chartier, Marion, et al. ""How (much) do flowers vary? Unbalanced disparity among flower functional modules and a mosaic pattern of morphospace occupation in the order Ericales."" Proc. R. Soc. B. Vol. 284. No. 1852. The Royal Society, 2017.",Angiosperms,Discrete,No,Dissimilarity matric + PCoA,mean pairwise dissimilarity + euclidean distance,PERMANOVA,No,,
2017,"Martinez, Christopher M., and John S. Sparks. ""Malagasy cichlids differentially limit impacts of body shape evolution on oral jaw functional morphology."" Evolution (2017).",Cichlids,2D landmarks,Yes,Procrustes PCA,Procrustes distances (geomorph),ANOVA,Yes,,
2017,"Chomicki, Guillaume, and Susanne S. Renner. ""Partner abundance controls mutualism stability and the pace of morphological change over geologic time."" Proceedings of the National Academy of Sciences 114.15 (2017): 3951-3956.",Rubiacea,DTT pipeline,Yes,DTT pipeline,DTT (morpho evolution in relation to diversification),Model fitting,Yes,,
2017,"Sansalone, G., et al. ""Influence of evolutionary allometry on rates of morphological evolution and disparity in strictly subterranean moles (Talpinae, Talpidae, Lipotyphla, Mammalia)."" Journal of Mammalian Evolution (2017): 1-14.",Lipotyphla,2D landmarks,No,Procrustes PCA,Procrustes distances (geomorph),ANOVA,Yes,,
2017,"Larouche, Olivier, Miriam L. Zelditch, and Richard Cloutier. ""Fin modules: an evolutionary perspective on appendage disparity in basal vertebrates."" BMC biology 15.1 (2017): 32.",Fish,Discrete,No,MCA (multiple correspondence analyses),?,Correlation (Fisher's exact test + Spearman's rank),No,,
2017,"Law, Chris J., Graham J. Slater, and Rita S. Mehta. ""Lineage diversity and size disparity in Musteloidea: testing patterns of adaptive radiation using molecular and fossil-based methods."" Systematic Biology (2017).",Carnivora,1D Continuous,Yes,-,-,-,-,Diversification analysis,
2017,"Drouyer, Sébastien, et al. ""Sparse Stereo Disparity Map Densification using Hierarchical Image Segmentation."" International Symposium on Mathematical Morphology and Its Applications to Signal and Image Processing. Springer, Cham, 2017.",-,-,-,-,-,-,-,Image processing,
2017,"García-Navas, Vicente, et al. ""Phenotypic disparity in Iberian short-horned grasshoppers (Acrididae): the role of ecology and phylogeny."" BMC evolutionary biology 17.1 (2017): 109.",Insects,1D Continuous,Yes,PCA,DTT (morpho evolution in relation to diversification),Model fitting,No (but mapped),,
2017,"Gerber, Sylvain. ""The geometry of morphospaces: lessons from the classic Raup shell coiling model."" Biological Reviews 92.2 (2017): 1142-1155.",Amonites,2D landmarks,Yes,Procrustes PCA,Procrustes distances + other distances,Raup-space,No,,to check!
2017,"Wilberg, Eric W. ""Investigating patterns of crocodyliform cranial disparity through the Mesozoic and Cenozoic."" Zoological Journal of the Linnean Society (2017): zlw027.",Crocodiles,2D landmarks,No,RWA (Relative Warp Analysis),sum of ranges + sum of variance + prdocut of ranges + product of variance,?,Yes,,to check!
2017,"Lóriga, Josmaily, et al. ""Phylogenetic relationships of two Cuban spleenworts with unusual morphology: Asplenium (Schaffneria) nigripes and Asplenium pumilum (Aspleniaceae, leptosporangiate ferns)."" Plant Systematics and Evolution 303.2 (2017): 165-176.",-,-,-,-,-,-,-,Phylo Analysis,
2017,"Nanova, Olga, and Miguel Prôa. ""Cranial features of mainland and Commander Islands (Russia) Arctic foxes (Vulpes lagopus) reflect their diverging foraging strategies."" Polar Research 36.sup1 (2017): 7.",-,-,-,-,-,-,-,Classic 1D differences,
2017,"Randau, Marcela, and Anjali Goswami. ""Unravelling intravertebral integration, modularity and disparity in Felidae (Mammalia)."" Evolution & Development 19.2 (2017): 85-95.",-,-,-,-,-,-,-,Already collected,
2017,"Rocatti, Guido, et al. ""Early evolutionary diversification of mandible morphology in the New World monkeys (Primate, Platyrrhini)."" Journal of Human Evolution 113 (2017): 24-37.",Primates,2D landmarks,No,Procrustes PCA,"Foote's disparity measurement (Foote 1993, Neige 2003) + Procrustes distances",PGLS (PC ~ trait),No (but mapped),,
2017,"Chakra, Maria Abou, Miroslav Lovric, and Jon R. Stone. ""Predicting Morphological Disparities In Sea Urchin Skeleton Growth And Form."" bioRxiv (2017): 133900.",-,-,-,-,-,-,-,unpub,
2017,"Deline, Bradley, and James R. Thomka. ""The role of preservation on the quantification of morphology and patterns of disparity within Paleozoic echinoderms."" Journal of Paleontology (2017): 1-15.",Echinoderms,Discrete,Yes,PCO,Average square distance,Mantel test,No,,
2017,"Valero, Katharina C. Wollenberg, et al. ""Transcriptomic and macroevolutionary evidence for phenotypic uncoupling between frog life history phases."" Nature Communications 8 (2017).",Frogs,Discrete,Yes,DTT pipeline,DTT (morpho evolution in relation to diversification),Model fitting,No,,
2017,"Fernández-Mazuecos, Mario, and Beverley J. Glover. ""The evo-devo of plant speciation."" Nature Ecology & Evolution 1 (2017): 0110.",-,-,-,-,-,-,-,review,
2017,"Tokita, Masayoshi, et al. ""Cranial shape evolution in adaptive radiations of birds: comparative morphometrics of Darwin's finches and Hawaiian honeycreepers."" Phil. Trans. R. Soc. B 372.1713 (2017): 20150481.",,3D landmarks,No,Procrustes PCA,?,Partial Least Squares,No (but mapped),,
2017,"Finnegan, Darby. ""Convergence in Diet and Morphology in Marine and Freshwater Cottoid Fishes."" (2017).",-,-,-,-,-,-,-,not available (paywall),
2017,"Zamora, Samuel, and Imran A. Rahman. ""Progress in echinoderm paleobiology."" Journal of Paleontology 91.4 (2017): 579-581.",-,-,-,-,-,-,-,review,
2017,"Cai, Yaoping, et al. ""Taxonomy of the late Ediacaran index fossil Cloudina and a new similar taxon from South China."" Precambrian Research (2017).",-,-,-,-,-,-,-,morpho description,
2017,"SUMMERS, MINDI M., CHARLES G. MESSING, and GREG W. ROUSE. ""The genera and species of Comatulidae (Comatulida: Crinoidea): taxonomic revisions and a molecular and morphological guide."" Zootaxa 4268.2 (2017): 151-190.",-,-,-,-,-,-,-,not available (paywall),
2017,"Maestri, Renan, et al. ""The ecology of a continental evolutionary radiation: Is the radiation of sigmodontine rodents adaptive?."" Evolution 71.3 (2017): 610-632.",Rodents,2D landmarks,No,Procrustes PCA,DTT pairwise average squared Euclidean distance,Morphological Disparity Index (MDI) statistics,Yes,,
2017,"Nespolo, Roberto F., Julio Figueroa, and Jaiber J. Solano-Iguaran. ""Studying the evolutionary significance of thermal adaptation in ectotherms: The diversification of amphibians’ energetics."" Journal of Thermal Biology 68 (2017): 5-13.",Amphibians,Metabolic Rate,Yes,NA,MDI (Morphological disparity index - observed disparity vs median of expteded from BM),Model fitting,Yes,,
2017,"Vasil’ev, A. G., et al. ""Chernov’s compensation principle and the effect of rodent community completeness on the variability of bank vole (Clethrionomys glareolus) population in the Middle Urals."" Russian Journal of Ecology 48.2 (2017): 161-169.",Rodents,2D landmarks,No,Procrustes PCA,MNND (Mean nearest neighbour distance),Canonical analysis (PCM style),No,,
2017,"Kozak, Kenneth H. ""What drives variation in plethodontid salamander species richness over space and time?."" Herpetologica 73.3 (2017): 220-228.",-,-,-,-,-,-,-,review,
2017,"Vasil’ev, A. G., et al. ""Aftereffects of muskrat introduction in Western Siberia: Morphological and functional aspects."" Russian Journal of Biological Invasions 8.1 (2017): 1-9.",Rodents,2D landmarks,No,Procrustes PCA,MNND (Mean nearest neighbour distance),Canonical analysis (PCM style),No,,
2017,"Gatimel, Nicolas, et al. ""Continued existence of significant disparities in the technical practices of sperm morphology assessment and the clinical implications: results of a French questionnaire."" Fertility and sterility 107.2 (2017): 365-372.",-,-,-,-,-,-,-,Out of topic,
2017,"Koc, C. Bartesaghi, et al. ""Mapping Local Climate Zones for urban morphology classification based on airborne remote sensing data."" Urban Remote Sensing Event (JURSE), 2017 Joint. IEEE, 2017.",-,-,-,-,-,-,-,Out of topic,
2017,"Nespolo, Roberto F., Jaiber J. Solano-Iguaran, and Francisco Bozinovic. ""Phylogenetic analysis supports the aerobic-capacity model for the evolution of endothermy."" The American Naturalist 189.1 (2017): 13-27.",Vertebrates,Metabolic Rate,Yes,NA,MDI (Morphological disparity index - observed disparity vs median of expteded from BM),Model fitting,Yes,,
2017,"Muñoz, Martha M., Philip SL Anderson, and S. N. Patek. ""Mechanical sensitivity and the dynamics of evolutionary rate shifts in biomechanical systems."" Proc. R. Soc. B. Vol. 284. No. 1847. The Royal Society, 2017.",-,-,-,-,-,-,-,Out of topic,
2017,"Cantalapiedra, J. L., et al. ""Decoupled ecomorphological evolution and diversification in Neogene-Quaternary horses."" Science 355.6325 (2017): 627-630.",Perissodactyla,Body mass,No,NA,DTT pairwise Euclidean distance,Model fitting,Yes,,
2017,"Herrera_Flores, Jorge A., Thomas L. Stubbs, and Michael J. Benton. ""Macroevolutionary patterns in Rhynchocephalia: is the tuatara (Sphenodon punctatus) a living fossil?."" Palaeontology 60.3 (2017): 319-328.",Rhynchocephalia,2D landmarks,No,Procrustes PCA,Euclidean procrustes distances,NPMANOVA,No (but mapped),,
2017,"Floeter, Sergio R., et al. ""Phylogenetic perspectives on reef fish functional traits."" Biological Reviews (2017).",Fishes,Body size,Yes,NA,DTT pairwise Euclidean distance,Model fitting,No,,
2017,"Harvey, Thomas HP, and Nicholas J. Butterfield. ""Exceptionally preserved Cambrian loriciferans and the early animal invasion of the meiobenthos."" Nature Ecology & Evolution 1 (2017): 0022.",-,-,-,-,-,-,-,morpho description,
2017,"Lambert, Olivier, et al. ""Earliest mysticete from the late Eocene of Peru sheds new light on the origin of baleen whales."" Current Biology 27.10 (2017): 1535-1541.",-,-,-,-,-,-,-,morpho description,morphological disparity hypothesis still described in the abstract!
2017,"Bochaton, Corentin, et al. ""Human impacts reduce morphological diversity in an insular species of lizard."" Proc. R. Soc. B. Vol. 284. No. 1857. The Royal Society, 2017.",Anolis,2D landmarks,No,Procrustes PCA,Euclidean procrustes distances,Procrustes ANOVA,No,,
2017,"Armbruster, William Scott. ""The specialization continuum in pollination systems: diversity of concepts and implications for ecology, evolution and conservation."" Functional Ecology 31.1 (2017): 88-100.",-,-,-,-,-,-,-,review,
2017,"Nesbitt, Sterling J., et al. ""The earliest bird-line archosaurs and the assembly of the dinosaur body plan."" Nature 544.7651 (2017): 484-487.",,Discrete,Yes,PCO,eighted mean pairwise dissimilarity,NA,No,,
2017,"Wang, Shuo, et al. ""Extreme ontogenetic changes in a ceratosaurian theropod."" Current Biology 27.1 (2017): 144-148.",-,-,-,-,-,-,-,out of topic,
2017,"Tada, Shinya, et al. ""Diversification of functional morphology in herbivorous cichlids (Perciformes: Cichlidae) of the tribe Tropheini in Lake Tanganyika."" Hydrobiologia 791.1 (2017): 83-101.",Fishes,2D landmarks,Yes,Procrustes PCA,PC1&2 values,phyloANOVA,Yes,,
2017,"McLean, Bryan S. ""Digest: Splendid (continental) radiations."" Evolution 71.3 (2017): 802-803.",-,-,-,-,-,-,-,review,
2017,"Slater, Graham J., Jeremy A. Goldbogen, and Nicholas D. Pyenson. ""Independent evolution of baleen whale gigantism linked to Plio-Pleistocene ocean dynamics."" Proc. R. Soc. B. Vol. 284. No. 1855. The Royal Society, 2017.",Whales,Body size,Yes,NA,Area between observed and median,Model fitting,Yes,,
2017,"Martínez-Cabrera, Hugo I., Jingming Zheng, and Emilio Estrada-Ruiz. ""Wood functional disparity lags behind taxonomic diversification in angiosperms."" Review of Palaeobotany and Palynology 246 (2017): 251-257.",Angiosperms,Continuous,No,PCA,Area between observed and median,Model fitting,Yes,,
2017,"Castillo, Daniela L., et al. ""Skull ontogeny and modularity in two species of Lagenorhynchus: Morphological and ecological implications."" Journal of morphology 278.2 (2017): 203-214.",Cetaceans,2D landmarks,No,Regression PCA,Regression score,ANOVA,,,
2017,"Minter, Nicholas J., et al. ""Early bursts of diversification defined the faunal colonization of land."" Nature Ecology & Evolution 1.7 (2017): s41559-017.",-,-,-,-,-,-,-,out of topic,
2017,"Miller, Eliot T., et al. ""Radiating despite a Lack of Character: Ecological Divergence among Closely Related, Morphologically Similar Honeyeaters (Aves: Meliphagidae) Co-occurring in Arid Australian Environments."" The American Naturalist 189.2 (2017): E14-E30.",Meliphagidae,Continuous,Yes,pPCA,pairwise euclidean distance,Canonical analysis (PCM style),Yes,,
2017,"Caromel, Aude GM, Daniela N. Schmidt, and Emily J. Rayfield. ""Ontogenetic constraints on foraminiferal test construction."" Evolution & Development 19.3 (2017): 157-168.",Foraminifera,Continuous,Yes,Raup-space,space coordinates,ANOVA,,,
2017,"Dececchi, T. Alexander, et al. ""Relating Ediacaran Fronds."" Paleobiology 43.2 (2017): 171-180.",-,-,-,-,-,-,-,review,
2017,"Cooney, Christopher R., et al. ""Mega-evolutionary dynamics of the adaptive radiation of birds."" Nature 542.7641 (2017): 344-347.",Birds,3D landmarks,No,Procrustes PCA,sum of variance,Model fitting,Yes,,
2017,"Zato_, Micha_, et al. ""The first direct evidence of a Late Devonian coelacanth fish feeding on conodont animals."" The Science of Nature 104.3-4 (2017): 26.",-,-,-,-,-,-,-,out of topic,
2017,"Belben, Rachel A., et al. ""Ecological impact of the end-Cretaceous extinction on lamniform sharks."" PLoS One 12.6 (2017): e0178294.",Shark,Continuous,No,PCA,NA,MANOVA,No,,
2017,"King, Dawn M., Adam D. Scott, and Sonya Bahar. ""Multiple phase transitions in an agent-based evolutionary model with neutral fitness."" Royal Society Open Science 4.4 (2017): 170005.",-,-,-,-,-,-,-,out of topic,
2017,"Arnold, Patrick, Eli Amson, and Martin S. Fischer. ""Differential scaling patterns of vertebrae and the evolution of neck length in mammals."" Evolution (2017).",Mammals,Continuous,No,PCA,NA,lm + t-test,Yes,,
2017,"Zeng, Han, et al. ""Appendages of an early Cambrian metadoxidid trilobite from Yunnan, SW China support mandibulate affinities of trilobites and artiopods."" Geological Magazine (2017): 1-23.",-,-,-,-,-,-,-,morpho description,
2017,"Evans, Kory M., et al. ""Fluctuations in evolutionary integration allow for big brains and disparate faces."" Scientific reports 7 (2017).",Vertebrates,3D landmarks,No,Procrustes PCA,NA,Covariance ratio,No (but mapped),,
2017,"Nikolov, Lachezar A., and Miltos Tsiantis. ""Using mustard genomes to explore the genetic basis of evolutionary change."" Current Opinion in Plant Biology 36 (2017): 119-128.",-,-,-,-,-,-,-,review,
2017,"Comeau, Ariane, Cory D. Bishop, and Christopher B. Cameron. ""Ossicle development of the crinoid Florometra serratissima through larval stages."" Canadian Journal of Zoology 95.3 (2017): 183-192.",-,-,-,-,-,-,-,out of topic,
2017,"Curth, Stefan, Martin S. Fischer, and Kornelius Kupczik. ""Patterns of integration in the canine skull: an inside view into the relationship of the skull modules of domestic dogs and wolves."" Zoology (2017).",Carnivora,3D landmarks,No,NA,Disparity Box 3D,Partial Least Squares,No,,
2017,"Lamsdell, James C., and Paul A. Selden. ""From success to persistence: Identifying an evolutionary regime shift in the diverse Paleozoic aquatic arthropod group Eurypterida, driven by the Devonian biotic crisis."" Evolution 71.1 (2017): 95-110.",Eurypterida,Discrete,Yes,PCO,Sum of variance + sum of range,PERMANOVA + CI overlap,No,,
2017,"García-Roa, Roberto, et al. ""Macroevolutionary diversification of glands for chemical communication in squamate reptiles."" Scientific Reports 7 (2017).",Squamates,Glands for chemical communication,No,NA,DTT pairwise Euclidean distance,Model fitting,Yes,,
2017,"Pinheiro, Felipe L., and Taissa Rodrigues. ""Anhanguera taxonomy revisited: is our understanding of Santana Group pterosaur diversity biased by poor biological and stratigraphic control?."" PeerJ 5 (2017): e3285.",-,-,-,-,-,-,-,morpho description,
2017,"Fischer, Valentin, et al. ""Plasticity and convergence in the evolution of short-necked plesiosaurs."" Current Biology (2017).",Plesiosaur,Discrete,Yes,PCO,NA,Cluster dendrogram analysis,No,,
2017,"Droser, Mary L., Lidya G. Tarhan, and James G. Gehling. ""The rise of animals in a changing environment: global ecological innovation in the late Ediacaran."" Annual Review of Earth and Planetary Sciences 45.1 (2017).",-,-,-,-,-,-,-,review,
2017,"Echarri, Sebastian, et al. ""Mandible morphology and diet of the South American extinct metatherian predators (Mammalia, Metatheria, Sparassodonta)."" Earth and Environmental Science Transactions of The Royal Society of Edinburgh 106.4 (2017): 277-288.",Metatheria,2D landmarks,No,PCA,NA,LDA,No,,
2017,"Fortey, Richard A. ""Response by Richard A. Fortey for the presentation of the 2016 Paleontological Society Medal."" Journal of Paleontology 91.6 (2017): 1351-1352.",-,-,-,-,-,-,-,not available (paywall),
2017,"Taylor, Kristian H., Greg W. Rouse, and Charles G. Messing. ""Systematics of Himerometra (Echinodermata: Crinoidea: Himerometridae) based on morphology and molecular data."" Zoological Journal of the Linnean Society (2017): zlx009.",-,-,-,-,-,-,-,out of topic,
2017,"Mayr, Gerald, Vanesa L. De Pietri, and R. Paul Scofield. ""A new fossil from the mid-Paleocene of New Zealand reveals an unexpected diversity of world’s oldest penguins."" The Science of Nature 104.3-4 (2017): 9.",-,-,-,-,-,-,-,morpho description,
2017,"Hetherington, Alexander J., and Liam Dolan. ""The evolution of lycopsid rooting structures: conservatism and disparity."" New Phytologist 215.2 (2017): 538-544.",-,-,-,-,-,-,-,review,
2017,"Spiekman, Stephan NF, and Ingmar Werneburg. ""Patterns in the bony skull development of marsupials: high variation in onset of ossification and conserved regions of bone contact."" Scientific Reports 7 (2017).",-,-,-,-,-,-,-,(evo-devo),
2017,"Blanke, Alexander, et al. ""Form–function relationships in dragonfly mandibles under an evolutionary perspective."" Journal of The Royal Society Interface 14.128 (2017): 20161038.",Odonata,3D landmarks,No,Procrustes PCA,Procrustes distances (geomorph),phyloANOVA,Yes,,
2017,"Neubauer, Thomas A., et al. ""The discovery of Bulinus (Pulmonata: Planorbidae) in a Miocene palaeolake in the Balkan Peninsula."" Journal of Molluscan Studies (2017): 1-9.",-,-,-,-,-,-,-,morpho description,
2017,"Powell, G. L., et al. ""Shape Variation in the Dermatocranium of the Greater Short-Horned Lizard Phrynosoma hernandesi (Reptilia: Squamata: Phrynosomatidae)."" Evolutionary Biology 44.2 (2017): 240-260.",Squamates,2D landmarks,No,Procrustes PCA,centroid size,ANCOVA,No,,
2017,"Arregoitia, Luis D. Verde, Diana O. Fisher, and Manuel Schweizer. ""Morphology captures diet and locomotor types in rodents."" Open Science 4.1 (2017): 160957.",Rodents,Continuous,Yes,nMDS,NA,phyloANOVA + phyloLDA,yes,,
2017,"Vignon, Matthias. ""Investigating Morphospace Occupation in Multi-Scale Ecological and Evolutionary Data Using Regression Tree: Case Studies and Perspectives."" Evolutionary Biology 44.1 (2017): 120-134.",Fishes,2D landmarks,No,Procrustes PCA,distance from centroids,GLS,No,,
2017,"Hipsley, Christy A., and Johannes Müller. ""Developmental dynamics of ecomorphological convergence in a transcontinental lizard radiation."" Evolution 71.4 (2017): 936-948.",Squamates,3D landmarks,No,Procrustes PCA,Procrustes distances (geomorph),distance PGLS,Yes,,
2017,"Button, David J., Paul M. Barrett, and Emily J. Rayfield. ""Craniodental functional evolution in sauropodomorph dinosaurs."" Paleobiology (2017): 1-28.",Sauropoda,Continuous + discrete,No,,Product of variance,NPMANOVA,No,,
2017,"Jablonski, David. ""Approaches to Macroevolution: 2. Sorting of Variation, Some Overarching Issues, and General Conclusions."" Evolutionary Biology (2017): 1-25.",-,-,-,-,-,-,-,review,
2017,"Brocklehurst, Neil. ""Rates of morphological evolution in Captorhinidae: an adaptive radiation of Permian herbivores."" PeerJ 5 (2017): e3200.",Captorhinidae,Discrete,Yes,PCoA,sum of variance,NA,No (but mapped),,
2017,"Puzachenko, Andrey Yu, Alexei V. Abramov, and Viatcheslav V. Rozhnov. ""Cranial variation and taxonomic content of the marbled polecat Vormela peregusna (Mustelidae, Carnivora)."" Mammalian Biology-Zeitschrift für Säugetierkunde 83 (2017): 10-20.",Carnivora,Continuous,No,NMDS,Group centroid,neigbor joining of the centroids,No,,
2017,"Springer, Mark S., et al. ""Waking the undead: Implications of a soft explosive model for the timing of placental mammal diversification."" Molecular phylogenetics and evolution 106 (2017): 86-102.",-,-,-,-,-,-,-,out of topic,
2017,"Iijima, Masaya. ""Assessment of trophic ecomorphology in non_alligatoroid crocodylians and its adaptive and taxonomic implications."" Journal of Anatomy (2017).",-,-,-,-,-,-,-,Biometric analysis,
2017,"Boessenecker, Robert W., et al. ""A toothless dwarf dolphin (Odontoceti: Xenorophidae) points to explosive feeding diversification of modern whales (Neoceti)."" Proc. R. Soc. B. Vol. 284. No. 1861. The Royal Society, 2017.",-,-,-,-,-,-,-,Biometric analysis,
2017,"Maiorino, Leonardo, et al. ""Macroevolutionary patterns in cranial and lower jaw shape of ceratopsian dinosaurs (Dinosauria, Ornithischia): phylogeny, morphological integration, and evolutionary rates."" Evolutionary Ecology Research 18.2 (2017): 123-167.",-,-,-,-,-,-,-,No access (broken link),
2017,"García_Roa, Roberto, et al. ""Heterogeneous tempo and mode of evolutionary diversification of compounds in lizard chemical signals."" Ecology and Evolution 7.4 (2017): 1286-1296.",Squamates,Chemical signals,No,NA,DTT pairwise average squared Euclidean distance,Model fitting,Yes,,
2017,"Wray, Kenneth P., and Scott J. Steppan. ""Ecological opportunity, historical biogeography and diversification in a major lineage of salamanders."" Journal of Biogeography 44.4 (2017): 797-809.",-,-,-,-,-,-,-,diversification analysis,
2017,"Baryshnikov, Gennady F., and Andrey Yu Puzachenko. ""Morphometric analysis of metacarpal and metatarsal bones of cave bears (Carnivora, Ursidae)."" Fossil Imprint 73.1-2 (2017): 7-47.",-,-,-,-,-,-,-,No access (broken link),
2017,"Candela, Adriana M., Nahuel A. Muñoz, and César M. García_Esponda. ""The tarsal_metatarsal complex of caviomorph rodents: Anatomy and functional_adaptive analysis."" Journal of Morphology 278.6 (2017): 828-847.",Rodents,2D landmarks,No,Procrustes PCA,NA,NA,No,,good example of pattern description
2017,"Zheng, Daran, et al. ""Extreme adaptations for probable visual courtship behaviour in a Cretaceous dancing damselfly."" Scientific Reports 7 (2017).",-,-,-,-,-,-,-,morpho description,
2017,"García_Navas, Vicente, et al. ""Ecological drivers of body size evolution and sexual size dimorphism in short_horned grasshoppers (Orthoptera: Acrididae)."" Journal of Evolutionary Biology (2017).",Orthoptera,Continuous,Yes,NA,DTT pairwise average squared Euclidean distance,Model fitting,Yes,,
1992,"Briggs, Derek EG, Richard A. Fortey, and Matthew A. Wills. ""Morphological disparity in the Cambrian."" Science 256.5064 (1992): 1670-1673.",Arthropods,Discrete,Yes,PCA,distance from centroids + product of variances + product of ranges,NA,No,,
